{
  "$schema": "https://json-schema.org/draft/2020-12/schema",
  "$id": "https://github.com/NVIDIA/NemoClaw/schemas/onboard-config.schema.json",
  "title": "NemoClaw onboard performance budget config",
  "description": "Advisory warm-system cloud onboard timing budget consumed by the nightly scorecard.",
  "type": "object",
  "additionalProperties": false,
  "required": [
    "$comment",
    "schemaVersion",
    "mode",
    "scope",
    "totalBudgetMs",
    "regressionWarning",
    "phaseRegressionWarning"
  ],
  "properties": {
    "$comment": {
      "type": "string"
    },
    "schemaVersion": {
      "const": 1
    },
    "mode": {
      "const": "advisory"
    },
    "scope": {
      "type": "string",
      "minLength": 1
    },
    "totalBudgetMs": {
      "type": "number",
      "minimum": 0
    },
    "regressionWarning": {
      "$ref": "#/$defs/threshold"
    },
    "phaseRegressionWarning": {
      "$ref": "#/$defs/threshold"
    }
  },
  "$defs": {
    "threshold": {
      "type": "object",
      "additionalProperties": false,
      "required": ["minDeltaMs", "minPercent"],
      "properties": {
        "minDeltaMs": {
          "type": "number",
          "minimum": 0
        },
        "minPercent": {
          "type": "number",
          "minimum": 0
        }
      }
    }
  }
}
